Name,Sector,Years.of.Operation,What.They.Did,How.Much.They.Raised,Why.They.Failed,Takeaway
Yelp Deals,Information,8 (2011-2019),Local deal platform,$500M (Yelp),Faded 2019; lost to Groupon; deal fatigue,Deals fade out
Zaarly,Information,6 (2011-2017),Local service marketplace,$15M,Faded 2017; lost to TaskRabbit; low scale,Services need reach
Zappos Labs,Information,5 (2013-2018),Experimental retail projects,$1.5B (Zappos),Faded 2018; lost to Amazon core; low impact,Experiments need wins
Zappos Local,Information,5 (2015-2020),Local shopping platform,$1.5B (Zappos),Faded 2020; lost to Amazon; low uptake,Local needs pull
Zing,Information,5 (2013-2018),Niche gadget retailer,$3M,Closed 2018; lost to Amazon; low scale,Gadgets need giants
Zola Books,Information,6 (2013-2019),Indie e-book retailer,$10M,Faded 2019; lost to Amazon; low demand,Books need scale